{
  "id": "mrnsg",
  "title": "mrnsg.title",
  "subtitle": "mrnsg.subtitle",
  "demoGifSrc": "/images/mrnsg/appGif.gif",
  "ogImage": "/images/mrnsg/og.png",
  "description": "mrnsg.description",
  "overview": {
    "projectType": "mrnsg.overview.projectType",
    "period": "2025.01",
    "introduction": "mrnsg.overview.introduction",
    "features": "mrnsg.overview.features",
    "techStack": [
      "TypeScript"
    ],
    "github": "https://github.com/mogiyoon/mogiyoon-react-native-simple-grid",
    "demo": "https://www.npmjs.com/package/mogiyoon-react-native-simple-grid"
  },
  "summaries": [
    {
      "id": "development",
      "title": "mrnsg.summaries.development.title",
      "parts": [
        [
          {
            "type": "subtitle",
            "id": "cause",
            "content": "mrnsg.summaries.development.parts.0.subtitle"
          },
          {
            "type": "image",
            "alt": "npm 사진",
            "src": "/images/mrnsg/overview/recentNpm.png",
            "caption": "mrnsg.summaries.development.parts.0.caption"
          },
          {
            "type": "text",
            "category": "problem",
            "content": "mrnsg.summaries.development.parts.0.0"
          },
          {
            "type": "text",
            "category": "problem",
            "content": "mrnsg.summaries.development.parts.0.1"
          }
        ],
        [
          {
            "type": "subtitle",
            "id": "process",
            "content": "mrnsg.summaries.development.parts.1.subtitle"
          },
          {
            "type": "image",
            "alt": "npm 사진",
            "src": "/images/mrnsg/overview/implementList.png",
            "caption": "mrnsg.summaries.development.parts.1.caption1"
          },
          {
            "type": "text",
            "category": "solution",
            "content": "mrnsg.summaries.development.parts.1.0"
          },
          {
            "type": "image",
            "alt": "npm 사진",
            "src": "/images/mrnsg/overview/implementRow.png",
            "caption": "mrnsg.summaries.development.parts.1.caption2"
          },
          {
            "type": "text",
            "category": "solution",
            "content": "mrnsg.summaries.development.parts.1.1"
          }
        ],
        [
          {
            "type": "subtitle",
            "id": "deploy",
            "content": "mrnsg.summaries.development.parts.2.subtitle"
          },
          {
            "type": "image",
            "alt": "npm 사진",
            "src": "/images/mrnsg/overview/typeScript.png",
            "width": "40%",
            "caption": "mrnsg.summaries.development.parts.2.caption"
          },
          {
            "type": "text",
            "content": "mrnsg.summaries.development.parts.2.0"
          }
        ]
      ]
    },
    {
      "id": "troubleshooting",
      "title": "mrnsg.summaries.troubleshooting.title",
      "parts": [
        [
          {
            "type": "subtitle",
            "id": "troubleshooting",
            "content": "mrnsg.summaries.troubleshooting.parts.0.subtitle"
          },
          {
            "type": "image",
            "alt": "Document 사이트",
            "src": "/images/mrnsg/overview/TroubleShooting1.png",
            "caption": "mrnsg.summaries.troubleshooting.parts.0.caption"
          },
          {
            "type": "text",
            "category": "problem",
            "content": "mrnsg.summaries.troubleshooting.parts.1.0"
          },
          {
            "type": "text",
            "category": "analysis",
            "content": "mrnsg.summaries.troubleshooting.parts.1.1"
          },
          {
            "type": "text",
            "category": "solution",
            "content": "mrnsg.summaries.troubleshooting.parts.1.2"
          },
          {
            "type": "link",
            "label": "Create React Native Library NPM",
            "href": "https://www.npmjs.com/package/create-react-native-library"
          },
          {
            "type": "link",
            "label": "Create React Native Library Document",
            "href": "https://callstack.github.io/react-native-builder-bob/create"
          },
          {
            "type": "text",
            "category": "result",
            "content": "mrnsg.summaries.troubleshooting.parts.1.3"
          }
        ]
      ]
    },
    {
      "id": "results",
      "title": "mrnsg.summaries.results.title",
      "parts": [
        [
          {
            "type": "subtitle",
            "id": "result",
            "content": "mrnsg.summaries.results.parts.0.0"
          },
          {
            "type": "text",
            "content": "mrnsg.summaries.results.parts.0.1"
          },
          {
            "type": "text",
            "content": "mrnsg.summaries.results.parts.0.2"
          }
        ],
        [
          {
            "type": "subtitle",
            "id": "retrospect",
            "content": "mrnsg.summaries.results.parts.1.0"
          },
          {
            "type": "text",
            "content": "mrnsg.summaries.results.parts.1.1"
          },
          {
            "type": "text",
            "content": "mrnsg.summaries.results.parts.1.2"
          }
        ]
      ]
    },
    {
      "id": "blank",
      "title": "mrnsg.summaries.blank.title",
      "parts": []
    }
  ],
  "features": [
    {
      "name": "mrnsg.features.0.name",
      "description": "mrnsg.features.0.description",
      "icon": "CommunityIcon"
    },
    {
      "name": "mrnsg.features.1.name",
      "description": "mrnsg.features.1.description",
      "icon": "VideoIcon"
    },
    {
      "name": "mrnsg.features.2.name",
      "description": "mrnsg.features.2.description",
      "icon": "ShortFormIcon"
    },
    {
      "name": "mrnsg.features.3.name",
      "description": "mrnsg.features.3.description",
      "icon": "MarketIcon"
    }
  ],
  "screenshots": [
    {
      "title": "mrnsg 앱 로고",
      "src": "/images/mrnsg/Icon.svg"
    }
  ],
  "developmentProcess": [
    {
      "title": "mrnsg.developmentProcess.0.title",
      "content": "mrnsg.developmentProcess.0.content"
    },
    {
      "title": "mrnsg.developmentProcess.1.title",
      "content": "mrnsg.developmentProcess.1.content"
    },
    {
      "title": "mrnsg.developmentProcess.2.title",
      "content": "mrnsg.developmentProcess.2.content"
    }
  ],
  "license": {
    "name": "MIT",
    "url": "https://opensource.org/licenses/MIT"
  }
}
