{
  "$schema": "./project-schema.json",
  "id": "test-maker",
  "title": "test-maker.title",
  "subtitle": "test-maker.subtitle",
  "demoGifSrc": "/images/testMaker/appGif.gif",
  "ogImage": "/images/testMaker/og.png",
  "description": "test-maker.description",
  "overview": {
    "projectType": "test-maker.overview.projectType",
    "period": "2024.11 ~ 2025.02",
    "introduction": "test-maker.overview.introduction",
    "features": "test-maker.overview.features",
    "techStack": [
      "React Native",
      "Google Vision API",
      "Redux"
    ],
    "github": "https://github.com/mogiyoon/Test_Maker",
    "demo": "https://play.google.com/store/apps/details?id=com.test_maker"
  },
  "summaries": [
    {
      "id": "development",
      "title": "test-maker.summaries.development.title",
      "parts": [
        [
          {
            "type": "subtitle",
            "id": "vocabulary",
            "content": "test-maker.summaries.development.parts.0.subtitle"
          },
          {
            "type": "image",
            "src": "/images/testMaker/overview/MakerOcr.png",
            "alt": "OCR 기능",
            "caption": "test-maker.summaries.development.parts.0.caption"
          },
          {
            "type": "text",
            "category": "problem",
            "content": "test-maker.summaries.development.parts.0.0"
          },
          {
            "type": "text",
            "category": "solution",
            "content": "test-maker.summaries.development.parts.0.1"
          }
        ],
        [
          {
            "type": "subtitle",
            "id": "category",
            "content": "test-maker.summaries.development.parts.1.subtitle"
          },
          {
            "type": "image",
            "src": "/images/testMaker/overview/MakerWordEdit.png",
            "alt": "단어 편집",
            "caption": "test-maker.summaries.development.parts.1.caption"
          },
          {
            "type": "text",
            "category": "analysis",
            "content": "test-maker.summaries.development.parts.1.0"
          },
          {
            "type": "text",
            "category": "solution",
            "content": "test-maker.summaries.development.parts.1.1"
          }
        ],
        [
          {
            "type": "subtitle",
            "id": "word_test",
            "content": "test-maker.summaries.development.parts.2.subtitle"
          },
          {
            "type": "image",
            "src": "/images/testMaker/overview/TestWordPage.png",
            "alt": "단어장",
            "caption": "test-maker.summaries.development.parts.2.caption"
          },
          {
            "type": "text",
            "category": "problem",
            "content": "test-maker.summaries.development.parts.2.0"
          },
          {
            "type": "text",
            "category": "solution",
            "content": "test-maker.summaries.development.parts.2.1"
          }
        ],
        [
          {
            "type": "subtitle",
            "id": "word_test",
            "content": "test-maker.summaries.development.parts.3.subtitle"
          },
          {
            "type": "image",
            "src": "/images/testMaker/overview/TestTesting.png",
            "alt": "시험 기능",
            "caption": "test-maker.summaries.development.parts.3.caption"
          },
          {
            "type": "text",
            "category": "problem",
            "content": "test-maker.summaries.development.parts.3.0"
          },
          {
            "type": "text",
            "category": "solution",
            "content": "test-maker.summaries.development.parts.3.1"
          },
          {
            "type": "text",
            "category": "result",
            "content": "test-maker.summaries.development.parts.3.2"
          }
        ]
      ]
    },
    {
      "id": "troubleshooting",
      "title": "test-maker.summaries.troubleshooting.title",
      "parts": [
        [
          {
            "type": "subtitle",
            "id": "word_test",
            "content": "test-maker.summaries.troubleshooting.parts.0.subtitle"
          },
          {
            "type": "image",
            "src": "/images/testMaker/overview/TroubleShooting.png",
            "alt": "트러블슈팅",
            "caption": "test-maker.summaries.troubleshooting.parts.0.caption"
          },
          {
            "type": "text",
            "category": "problem",
            "content": "test-maker.summaries.troubleshooting.parts.0.0"
          },
          {
            "type": "text",
            "category": "solution",
            "content": "test-maker.summaries.troubleshooting.parts.0.1"
          },
          {
            "type": "text",
            "category": "result",
            "content": "test-maker.summaries.troubleshooting.parts.0.2"
          }
        ]
      ]
    },
    {
      "id": "results",
      "title": "test-maker.summaries.results.title",
      "parts": [
        [
          {
            "type": "subtitle",
            "id": "result",
            "content": "test-maker.summaries.results.parts.0.0"
          },
          {
            "type": "text",
            "content": "test-maker.summaries.results.parts.0.1"
          },
          {
            "type": "text",
            "content": "test-maker.summaries.results.parts.0.2"
          },
          {
            "type": "text",
            "content": "test-maker.summaries.results.parts.0.3"
          }
        ],
        [
          {
            "type": "subtitle",
            "id": "retrospect",
            "content": "test-maker.summaries.results.parts.1.0"
          },
          {
            "type": "link",
            "label": "mogiyoon-react-native-simple-grid",
            "href": "https://www.npmjs.com/package/mogiyoon-react-native-simple-grid"
          },
          {
            "type": "text",
            "content": "test-maker.summaries.results.parts.1.1"
          },
          {
            "type": "text",
            "content": "test-maker.summaries.results.parts.1.2"
          },
          {
            "type": "text",
            "content": "test-maker.summaries.results.parts.1.3"
          }
        ]
      ]
    },
    {
      "id": "blank",
      "title": "test-maker.summaries.blank.title",
      "parts": []
    }
  ],
  "features": [
    {
      "name": "test-maker.features.0.name",
      "description": "test-maker.features.0.description",
      "icon": "CameraIcon"
    }
  ],
  "screenshots": [
    {
      "title": "Icon",
      "src": "/images/testMaker/Icon.png"
    }
  ],
  "developmentProcess": [
    {
      "title": "test-maker.developmentProcess.0.title",
      "content": "test-maker.developmentProcess.0.content"
    }
  ],
  "license": {
    "name": "MIT",
    "url": "https://opensource.org/licenses/MIT"
  }
}
